price_UAH,city,main_area,second_area,street_name,subway,total_square,kitchen_square,living_square,rooms,total_floors,flat_floor,wall_type,checked_apartment,newbuild_name,animal,photo_counts,description,latitude,longitude,date,url
4 000,Харків,Слобідський,Балашовка,вул. Ковтуна,,40.0,9.0,40.0,1,10,10,кирпич,False,,,9,"Здається 1-кімнатна квартира неподалік від метро(15-20хв)!
Розташування: вул. Ковтуна, 15-20 хвилин пішки до м. Турбоатом і м. Заводська. Заводська
 Поверх: 10-й (ліфт працює)
 Ціна: 4000 грн/міс   світло і вода за лічильниками, застава 2000 грн

Простора і затишна, з необхідною побутовою технікою: пральна машина, холодильник, газова плита.
Встановлено якісні МПО вікна, що забезпечують тепло і тишу.
Проблем зі світлом практично не буває - ідеальне рішення для комфортного життя.
Розглядаються орендарі з домашніми тваринами (якщо собака, то до 10 кг); можливість додати спальне місце, за потреби; між дахом і стелею є додатковий поверх, тому не потрібно піклуватися про протікання
Поруч із будинком (до 500 м):
Для сім'ї: дитячий садок, школа.
Для здоров'я і покупок: аптека, магазини, кіоски.
Для прогулянок: парк і зелені зони.
Комунікації: газ, центральне водопостачання і каналізація, регулярне вивезення відходів.
Телефонуйте, щоб домовитися про перегляд і стати щасливим мешканцем цієї затишної квартири!",49.96182897,36.29035746,2025-01-21 12:40:17,https://dom.ria.com/uk/realty-dolgosrochnaya-arenda-kvartira-harkov-balashovka-kovtuna-ulitsa-32673552.html
5 500,Харків,Шевченківський,Олексїївка,вул. Енвера Ахсарова,,60.0,13.0,45.0,2,9,8,кирпич,False,,,7,"# код объекта 9760 
Здається простора двокімнатна квартира площею 60 м² в новобудові на Олексіївці. Квартира розташована на 8-му поверсі, що відкриває чудовий вид з вікон та забезпечує приємну атмосферу для проживання.

Будинок знаходиться в тихому і спокійному районі з розвиненою інфраструктурою. Поруч розташовані станція метро, супермаркети, дві школи та дитячі майданчики, що робить квартиру ідеальним варіантом для сімей або тих, хто цінує зручний доступ до всіх необхідних послуг.

Якщо вас зацікавила ця пропозиція, будь ласка, пишіть,",50.051984,36.198412,2025-01-21 12:39:42,https://dom.ria.com/uk/realty-dolgosrochnaya-arenda-kvartira-harkov-alekseevka-envera-ahsarova-ulitsa-32673545.html
6 000,Харків,Шевченківський,Павлове Поле,вул. Шекспіра,,54.8,6.5,,2,5,5,кирпич,False,,,8,"#8453
Здам двокімнатну квартиру на Павловому Полі, яка знаходиться за адресою вул. Шекспіра, 26.
Чудове розташування, поруч метро ""23 Серпня"" та вся необхідна інфраструктура.
Є всі меблі та техніка для Вашого комфортного проживання: електрочайник, плита, мікрохвильова піч, холодильник, пральна машина, пилосос, телевізор,  кондиціонер, ванна, балкон, лоджія, сигналізація.

Не пропустіть можливість зняти цю сучасну та якісну квартиру!",50.03316,36.215056,2025-01-21 12:39:29,https://dom.ria.com/uk/realty-dolgosrochnaya-arenda-kvartira-harkov-pavlovo-pole-shekspira-ulitsa-32673542.html
3 500,Харків,Київський,Салтівка,вул. Козакевича,Академіка Павлова,32.0,,17.0,1,9,9,панель,False,ЖК Птичка,,7,Сдам 1 к квартиру  студию    .м Академика Павлова ЖК Птичка  9 этаж  с тех этажем..Большой балкон застеклен.  Диван    шкаф купе  холодильник микроволновка стиральная машинка автомат болер. Рядом вся инфраструктура транспорт. Оплата 3500 +комунальные.Залоговая сумма1000. Услуги агенства 50 % от стоимости квартиры. тел.  XXXXXXXXXX,50.0124455,36.30851135,2025-01-21 12:26:54,https://dom.ria.com/uk/realty-dolgosrochnaya-arenda-kvartira-harkov-saltovka-kozakevicha-ulitsa-32673338.html
5 000,Харків,Індустріальний,Східний,бул. Івана Каркача,Тракторний завод,20.0,3.0,17.0,1,5,3,панель,False,ЖК Миру-3,,11,Слам квартиру студию  бульвар Ивана Каркача ХТЗ  Уютная жилая .Встроеная кухня холодильник диван 2 кресла  шкаф купе  санузел совмещен болер стиральная машинка автомат.Рядом магазины аптека остановка транспорта детсадик парк водоем.Оплата 5000 БЕЗ КОМУНАЛЬНЫХ ! Услуги агенства 50% от стоимости квартиры.тел. XXXXXXXXXX,49.92898177,36.39169203,2025-01-21 11:44:58,https://dom.ria.com/uk/realty-dolgosrochnaya-arenda-kvartira-harkov-vostochnyy-ivana-karkacha-bulvar-32673020.html
5 000,Харків,Салтівський,,вул. Руслана Плоходька,Академіка Барабашова,46.0,8.0,38.0,2,5,5,панель,False,ЖК Птичка,,6,"Хороший ремонт 
Роздільні кімнати",49.994632,36.352463,2025-01-21 11:17:52,https://dom.ria.com/uk/realty-dolgosrochnaya-arenda-kvartira-harkov-saltovskiy-ruslana-plohodko-ulitsa-32672950.html
3 500,Харків,Салтівський,,вул. Гвардійців-Широнінців,Салтівська,45.0,6.0,,2,9,9,цегла,False,,,10,"Сдам 2 комн. квартиру, Салтовка, ул. Гвардейцев широнинцев 54А 
Все условия.Есть большой холодильник, стиральная машина, бойлер, кондиционер, 2 дивана. В пешей доступности метро Героев труда, удобная транспортная развязка, супермаркеты, рынок, все рядом.  
Доп.",50.024751,36.35294,2025-01-20 20:51:48,https://dom.ria.com/uk/realty-dolgosrochnaya-arenda-kvartira-harkov-saltovskiy-gvardeytsev-shironintsev-ulitsa-32671990.html
4 500,Харків,Шевченківський,,вул. Станіслава Партали(Балакірєва),Ботанічний сад,69.0,9.0,,3,16,15,цегла,False,,,6,"Здам 3х кімнатну квартиру, Шевченківський, Павлово Поле, вул. Балакірєва 50, м. Ботанічний Сад.  
Квартира в житловому стані, укомплектована для проживання.  
Додатково + комунальні.  
Об'єкт  111-861-587",50.032757,36.238706,2025-01-20 20:51:47,https://dom.ria.com/uk/realty-dolgosrochnaya-arenda-kvartira-harkov-shevchenkovskiy-balakireva-ulitsa-32671989.html
3 500,Харків,Слобідський,Нові Дома (Слобідський),вул. Каденюка(Танкопія),Армійська,49.0,6.0,30.0,2,5,5,кирпич,False,,,5,"Квартира з усім необхідним для життя. До метро Армійська 7 хвилин. Магазини, транспорт поруч. На довгий срок",49.95378485,36.342901,2025-01-20 20:15:24,https://dom.ria.com/uk/realty-dolgosrochnaya-arenda-kvartira-harkov-novye-doma-slobodskoy-kadenyuka-tankopiya-ulitsa-32671892.html
4 000,Харків,Київський,Салтівка,пров. Шевченківський,Академіка Павлова,20.0,3.0,17.0,1,13,12,кирпич,False,ЖК Воробйові гори,,16,"Здам 2-х рівневу студію в новобудові ЖК Воробйові Гори, метро Ак. Павлова 10 хв пішки.

Якісний капітальний ремонт, стильний дизайн.

Панорамне вікно з гарним виглядом, світлий та функціональний інтер'єр.
Нова побутова техніка, нові меблі.
Є подушки, ковдри, постільна білизна, абсолютно весь посуд!
Заходь живи затишно і в комфорті!
Оплата за місяць складає 4500 грн плюс комунальні послуги.
Оплата послуг АН 50% за фактом вселення.",50.011745,36.304128,2025-01-20 17:40:17,https://dom.ria.com/uk/realty-dolgosrochnaya-arenda-kvartira-harkov-saltovka-shevchenkovskiy-pereulok-26820360.html
14 000,Харків,Основ’янський,,вул. Лисаветинська,Проспект Гагаріна,53.0,17.0,20.0,2,16,13,кирпич,False,ЖК Левада,,24,"Оренда шикарної квартири в центрі Харкова, ЖК Левада 1.
2 кімнатна квартира розташовується на 13 поверсі 16-поверхового будинку.
Це квартира, в якій є всі необхідні меблі і техніка, стане для вас комфортним будинком, в якому хочеться проводити час.
Розвинена інфраструктура, все необхідне для життя знаходиться в пішохідному доступу. До станції метро Левада - 5 хвилин.
Вартість оренди - 14000грн + комунальні.
Зателефонуйте! організуємо оперативний показ квартири!",49.97834985,36.24264651,2025-01-20 17:15:52,https://dom.ria.com/uk/realty-dolgosrochnaya-arenda-kvartira-harkov-osnovyanskiy-elizavetinskaya-ulitsa-32082041.html
3 500,Харків,Київський,Салтівка,пров. Шевченківський,Академіка Павлова,20.0,5.0,10.0,1,13,6,кирпич,False,ЖК Воробйові гори,True,6,"Сдам на длительный срок (от 6 месяцев) уютную однокомнатную смарт-квартиру в спальном районе Харькова, по адресу переулок Шевченковский, метро Академика Павлова.

Квартира расположена в тихом районе, вдали от шумных дорог. В пешей доступности вся инфраструктура: магазины, аптеки, школы, детские сады, парки, метро.

Квартира площадью 20 кв. м., полностью меблирована и оборудована всей необходимой бытовой техникой:

холодильник
стиральная машина
микроволновая печь
электроплита
телевизор
бойлер

Ремонт свежий, выполнен в светлых тонах. В квартире уютно и комфортно, как дома.

С животными по договорённости

Стоимость аренды: 3500 грн. в месяц. Коммунальные платежи оплачиваются отдельно.

Залог в размере месячной оплаты.

Звоните, договоримся о просмотре!",50.011745,36.304128,2025-01-20 17:15:41,https://dom.ria.com/uk/realty-dolgosrochnaya-arenda-kvartira-harkov-saltovka-shevchenkovskiy-pereulok-31348083.html
6 500,Харків,Основ’янський,Одеська,вул. Качанівська,,55.0,,,1,16,1,,False,ЖК Макіївська,,8,"Сдам 1к.кв. в новострое, Жилстрой 1, 55 м, 1/16 эт. 100 м от Зерновой, Новый современный и стильный ремонт, решётки на окнах, надёжная бронированная дверь. Счётчик на отопление, можно регулировать, поэтому отопление выходит 500 гр. В доме есть бомбоубежище. 6500+к.у.",49.953304,36.25604,2025-01-20 16:49:01,https://dom.ria.com/uk/realty-dolgosrochnaya-arenda-kvartira-harkov-odesskaya-kachanovskaya-ulitsa-32671048.html
5 000,Харків,Холодногірський,,вул. Котляра Євгена,,65.0,11.0,,2,8,8,кирпич,False,,,9,"номер обьєкта: 11879
Оренда чудової двокімнатної квартири в будинку типу «Сталінка»  це ідеальний варіант для тих, хто цінує комфорт, стиль і затишок!
Ключові характеристики:Тип будинку: Сталінка  міцний, надійний дім з високими стелями та просторими приміщеннями.
Поверх: 8-й  останній поверх, що забезпечує тишу без сусідів зверху та чудові краєвиди з вікон.Загальна площа: 65 м²  вдосталь місцядлякомфортногопроживання.Площа кухні: 11 м²  простора кухня, ідеальна для приготування їжі та приємних посиденьок. Кількість кімнат: 2 кімнати простір для відпочинку і роботи.Меблювання: Квартира повністю мебльована  все необхідне для комфортного проживання вже готове до використання.
Інтерєр квартири оформлений зі смаком, поєднуючи класичний стиль із сучасними елементами декору. Світлі стіни створюють атмосферу легкості та простору, а великі вікна забезпечують багато природного світла.Всі зручності поруч: магазини, кафе, школи та громадський транспорт, що робить цю квартиру ще привабливішою для оренди.Не пропустіть можливість насолоджуватися комфортом у просторій та стильній оселі! 3000  коммунальні",49.98884609,36.20800049,2025-01-20 15:55:15,https://dom.ria.com/uk/realty-dolgosrochnaya-arenda-kvartira-harkov-holodnaya-gora-krasnoarmeyskaya-ulitsa-32670468.html
3 000,Харків,Київський,,вул. Чернівецька,Академіка Павлова,20.0,5.0,10.0,1,7,1,кирпич,False,ЖК Воробйові гори,,7,"Код об'єкта: 9137
Здається квартира з євроремонтом на першому поверсі новобудови.
Загальна площа 19 кв.метрів.   
Квартира повністю мебльована сучасними меблями і готова до заселення. 
Вся необхідна побутова техніка: електрочайник, холодильник, мікрохвильова піч, варильна панель, пральна машина.
Скрізь економ-лампи.
Інтернет, телевізор, кондиціонер, холодильник, телевізор.
Оплата: оренда плюс опалення плюс вода та світло за лічильниками
Відмінне місце розташування! 
Всього 7 хвилин пішки до метро Академіка Павлова.
Близько до інфраструктури. Відмінний вибір для комфортного життя.  
Телефонуйте!",50.013042,36.311531,2025-01-20 15:41:36,https://dom.ria.com/uk/realty-dolgosrochnaya-arenda-kvartira-harkov-kievskiy-chernivetskaya-ulitsa-32670346.html
8 000,Харків,Слобідський,,в'їзд Тарасівський,Спортивна,65.0,6.0,40.0,3,11,7,,False,,,10,"Сдам 3к квартиру между метро Спортивная и Защитников Украины, Тарасовский вьезд на среднем этаже, рядом Чудо маркет, Конный Рынок, Металлист, остановка транспорта.
Квартира утеплена, 2 кондиционера, ремонт, вся необходимая техника, 2 застеклённых/зашитых балкона.
Ком. услуги.",49.983569,36.2718851,2025-01-20 15:22:03,https://dom.ria.com/uk/realty-dolgosrochnaya-arenda-kvartira-harkov-slobodskoy-tarasovskiy-vyezd-32670159.html
6 500,Харків,Шевченківський,Павлове Поле,просп. Науки,,32.0,7.0,22.0,1,7,3,кирпич,False,,,15,"Код обєкту:
Здається затишна квартира-студія з євроремонтом біля метро ""23 Серпня"", проспект Науки, 39.
Поверх: 3-й із 7. Загальна площа: 32 м². Кухня: 7 м², обєднана зі світлою вітальнею у форматі студії.
Планування: сучасна студія, що створює відчуття простору. Санвузол: суміщений.
Виконано якісний євроремонт із використанням сучасних матеріалів. Квартира повністю укомплектована стильними меблями, що поєднують комфорт і естетику.
Оснащення:Кондиціонер для зручного мікроклімату.Домофон для безпеки.Плазмовий телевізор.Повний набір побутової техніки.
Балкон: додає додаткового простору та затишку.
Будинок розташований у зручному районі, всього за 1 хвилину від метро ""23 Серпня"". Поруч є все необхідне для комфортного життя: магазини, кафе, супермаркети, зелена зона для прогулянок.
Квартира здається на тривалий термін, ідеально підходить для однієї особи або пари.
Світла, стильна та затишна  ця квартира стане чудовим домом для тих, хто цінує комфорт і зручність.
Запрошуємо на перегляд, квартира готова до заселення!
Орендна плата комунальні послуги",50.03149446,36.22097008,2025-01-20 13:51:03,https://dom.ria.com/uk/realty-dolgosrochnaya-arenda-kvartira-harkov-pavlovo-pole-lenina-prospekt-32669453.html
5 000,Харків,Київський,Салтівка,вул. Гвардійців-Широнінців,,65.0,7.0,,3,9,8,кирпич,False,,,15,"код 11875
Здається простора 3-кімнатна квартира в затишному районі Салтівки, біля легендарного ""Океана"". Це ідеальне місце для тих, хто цінує комфорт і зручність! Квартира на 8-му поверсі 9-поверхового будинку, загальна площа  65 м², кухня  7 м². Всередині  все, що потрібно для життя: сучасна техніка, включаючи холодильник, мікрохвильову піч, пральну машину, телевізор, пилосос і навіть кондиціонери в кожній кімнаті, щоб літо проходило в прохолоді. Є два засклені балкони, гардеробна, комора, всюди встановлені металопластикові вікна, що забезпечують тепло та шумоізоляцію. Дві кімнати повністю мебльовані, третя  вільна, ідеально для створення особистого простору або робочого кабінету. Санвузол роздільний, у ванній встановлений бойлер, що гарантує гарячу воду завжди. Розташування теж тішить  всього 15 хвилин прогулянки до метро ""Героїв Праці"". Поруч дитячі садочки, школи, супермаркети, аптеки, ринок, зупинки транспорту та навіть ТРЦ. Дозволено проживання з домашніми улюбленцями, тож ваш котик теж буде радий новій домівці! Ця квартира вже готова стати вашим новим затишним куточком. Всього 5000 грн на місяць плюс комунальні послуги  не пропустіть шанс на комфортне життя! Телефонуйте і приходьте на перегляд, поки інші ще думають!",50.026631,36.348866,2025-01-20 13:51:03,https://dom.ria.com/uk/realty-dolgosrochnaya-arenda-kvartira-harkov-saltovka-gvardeytsev-shironintsev-ulitsa-32669456.html
3 500,Харків,Київський,,пров. Шевченківський,Академіка Павлова,20.0,3.0,18.0,1,13,8,кирпич,False,ЖК Воробйові гори,,14,"Код 10640
Здається в оренду сучасна 1-кімнатна дворівнева квартира-студія в ЖК ""Воробйові гори"", яка стане ідеальним варіантом для комфортного життя.

Квартира виконана у стильному європейському дизайні з продуманим плануванням, що дозволяє максимально ефективно використовувати простір.
Всі необхідні меблі та сучасна техніка вже є в наявності, забезпечуючи затишок і зручність з першого дня проживання.

Житло розташоване на 8 поверсі 12-поверхового будинку, що відкриває чудові краєвиди та гарантує тишу і спокій.
Район має розвинену інфраструктуру: поруч є магазини, кафе, аптеки, зупинки транспорту та інші сервіси, необхідні для комфортного життя.

Ця квартира  поєднання стилю, зручності та комфорту.
Телефонуйте вже зараз, щоб дізнатися більше або домовитися про перегляд!",50.011745,36.304128,2025-01-20 13:29:23,https://dom.ria.com/uk/realty-dolgosrochnaya-arenda-kvartira-harkov-kievskiy-shevchenkovskiy-pereulok-32669346.html
2 500,Харків,Салтівський,,вул. Гарібальді,,26.0,3.0,18.0,1,5,5,панель,False,,,7,"Здам смарт-квартиру вул. Гарібальді, зупинка 2 хвилини, з ремонтом, сучасні меблі, пральна машина автомат, холодильник, бойлер, електропіч, 2500+ свiтло",50.00625,36.35532,2025-01-20 12:40:08,https://dom.ria.com/uk/realty-dolgosrochnaya-arenda-kvartira-harkov-saltovskiy-garibaldi-ulitsa-32668882.html
