price_UAH,city,main_area,second_area,street_name,subway,total_square,kitchen_square,living_square,rooms,total_floors,flat_floor,wall_type,checked_apartment,newbuild_name,animal,photo_counts,description,latitude,longitude,date,url
2 500,Харків,Київський,,вул. Нескорених(Героїв Праці),Героїв праці,40.0,8.0,17.0,1,16,11,,True,,,10,"Сдам чистую, аккуратную 1 комн кв рядом с м. Героев Труда. Кооперативный дом, чистейший подъезд, дом без прилётов. Всё необходимое есть.2500 грн+ коммуналка",50.02465456,36.3316311,2024-07-15 10:55:39,https://dom.ria.com/uk/realty-dolgosrochnaya-arenda-kvartira-harkov-kievskiy-geroev-truda-ulitsa-31721211.html
5 000,Харків,Салтівський,,вул. Академіка Павлова,Героїв праці,32.0,8.0,17.0,1,12,5,панель,True,,,18,"Первый дом от метро Героев Труда, рядом Компас, евроремонт, укомплектована мебелью и техникой. Для одного человека или пары, без животных. Дополнительно оплачиваются коммунальные услуги.",50.02216488,36.33508651,2024-07-11 21:12:19,https://dom.ria.com/uk/realty-dolgosrochnaya-arenda-kvartira-harkov-saltovskiy-akademika-pavlova-ulitsa-31926284.html
3 500,Харків,Київський,,вул. Дарвіна,Архітектора Бекетова,18.0,2.0,12.0,1,5,5,кирпич,True,,True,11,"Гостинка со своими службами с капитальным ремонтом, пеший ход до метро Архитектора Бекетова. Укомплектована мебелью и техникой.",49.99614008,36.24661425,2024-07-11 20:08:53,https://dom.ria.com/uk/realty-dolgosrochnaya-arenda-kvartira-harkov-kievskiy-darvina-ulitsa-31926036.html
6 500,Харків,Новобаварський,,вул. Волосна,Проспект Гагаріна,38.0,2.0,16.0,2,3,2,монолитно-кирпичный,True,,,9,"Інфраструктура (до 500 метрів): Школа, Дитячий садок, Супермаркет, ТРЦ, Ресторан, кафе, Дитячий майданчик, Лікарня, поліклініка, Магазин, кіоск, Бювет, Парк, зелена зона, Аптека, Відділення банку, банкомат, Відділення пошти, Ринок, Зупинка транспорту
Інфраструктура (до 500 метрів): Школа, Дитячий садок, Супермаркет, ТРЦ, Ресторан, кафе, Дитячий майданчик, Лікарня, поліклініка, Магазин, кіоск, Бювет, Парк, зелена зона, Аптека, Відділення банку, банкомат, Відділення пошти, Ринок, Зупинка транспорту
 Можна іноземцям, Можна студентам, Можна з дітьми, І ВІЙСЬКОВИМ!",49.96336965,36.22271671,2024-07-10 18:23:08,https://dom.ria.com/uk/realty-dolgosrochnaya-arenda-kvartira-harkov-novobavarskiy-volostnaya-ulitsa-31887043.html
3 200,Харків,Салтівський,,вул. Гвардійців-Широнінців,Студентська,26.0,7.0,13.0,1,9,7,панель,True,,,12,"Квартира с капитальным ремонтом, пеший ход до метро Студенческая и Г.Труда, напротив с/м Класс, укомплектована мебелью и техникой. Дополнительно оплачивается коммунальные услуги.",50.01734649,36.34391939,2024-07-10 13:50:54,https://dom.ria.com/uk/realty-dolgosrochnaya-arenda-kvartira-harkov-saltovskiy-gvardeytsev-shironintsev-ulitsa-31908179.html
3 500,Харків,Слобідський,,вул. Каденюка(Танкопія),Палац спорту,44.0,6.0,30.0,2,5,4,панель,True,,,5,"Сдам двухкомнатную квартиру на длительный срок. Кошечки, собачки, попугаи - приветствуются. Квартира в хорошем жилом состоянии. Пожалуйста звоните , спрашивайте, заселяйтесь! Уже свободно !ждем вас!",49.953272,36.31241,2024-07-04 08:59:10,https://dom.ria.com/uk/realty-dolgosrochnaya-arenda-kvartira-harkov-slobodskoy-kadenyuka-tankopiya-ulitsa-31869877.html
3 000,Харків,Київський,Салтівка,пров. Рубежанський,Турбоатом(Московський проспект),50.0,10.0,40.0,1,2,2,кирпич,True,,,9,"Здам на довгостроковий термін квартиру. Вона 2-х кімнатна, але в другу кімнату перенесемо особисті речі, і вона буде зачинена. Тому здається, як 1-кімн. Все необхідне для проживання є. Дуже спокійний район. Поруч 2 джерела з питною водою. Всі необхідні магазини в 2х хвилинах, як в зупинка громадського транспорту.  До метро Турбоатом 1 зупинка. Квартира дуже простора. Велика кухня, коридор та ванна кімната. Кімната 20 кв.м. під'їзд в гарному стані та завжди чистий. Зачиняється на ключ. Сусіди порядні. Також є сарайчик в 5ти метрах. За окрему плату можу запропонувати металевий гараж в 15ти метрах.",49.98187821,36.30617285,2024-07-02 15:44:33,https://dom.ria.com/uk/realty-dolgosrochnaya-arenda-kvartira-harkov-saltovka-bejankiy-peelok-30508924.html
7 500,Харків,Салтівський,524-ий мікрорайон,вул. Академіка Павлова,Героїв праці,40.0,,,1,23,15,газобетон,True,,,32,"Квартира 1-но кімнатна. В квартирі зроблений євроремонт. Вбудована кухня з технікою. Два спальних місця: двоспальне ліжко 1600×2000 з ортопедичним матрацом та розкладний диван також двоспальним. Кондиціонер,  холодильник , мікроволнова піч
Будинок під відеонаглядом.",50.0268478,36.3378844,2024-07-01 15:29:22,https://dom.ria.com/uk/realty-dolgosrochnaya-arenda-kvartira-harkov-524-yy-mikrorayon-akademika-pavlova-ulitsa-24865137.html
3 300,Харків,Київський,,вул. Чернівецька,Академіка Павлова,19.2,,17.2,1,7,2,кирпич,False,,,8,"Поруч метро, супермаркет, мебльована квартира з гарним ремонтом, порядні хозяїва",50.013042,36.311531,2024-07-01 13:54:40,https://dom.ria.com/uk/realty-dolgosrochnaya-arenda-kvartira-harkov-kievskiy-enivekaya-lia-28038005.html
3 800,Харків,Салтівський,,вул. Бучми,Героїв праці,45.0,8.0,28.0,2,9,3,панель,True,,True,13,"Квартира в хорошем состоянии, пеший ход до метро, полностью укомплектована мебелью и техникой. Можно с маленьким детьми, воспитанным мелким животным. Дополнительно оплачиваются коммунальные услуги.",50.029658,36.344494,2024-06-30 12:34:03,https://dom.ria.com/uk/realty-dolgosrochnaya-arenda-kvartira-harkov-saltovskiy-buchmy-ulitsa-31845347.html
3 000,Харків,Салтівський,,вул. Валентинівська,Студентська,52.0,8.0,30.0,2,9,7,панель,True,,True,12,"Квартира улучшенной планировки, пеший ход до метро Студенческая, в жилом состоянии, укомплектована необходимой техникой, одна комната свободная, дополнительно оплачивается свет и вода.",50.012329,36.33315,2024-06-27 20:03:21,https://dom.ria.com/uk/realty-dolgosrochnaya-arenda-kvartira-harkov-saltovskiy-valentinovskaya-ulitsa-31831361.html
3 800,Харків,Салтівський,,вул. Бучми,Героїв праці,45.0,8.0,30.0,2,5,3,панель,True,,True,11,"Пеший ход до транспорта, комнаты раздельные, чистое хорошее состояние, укомплектована необходимой мебелью и техникой. Можно с мелким животным, семье с детьми. Дополнительно оплачивается только свет, все коммунальные услуги оплачиваются хозяином.",50.022945,36.373413,2024-06-26 15:43:51,https://dom.ria.com/uk/realty-dolgosrochnaya-arenda-kvartira-harkov-saltovskiy-buchmy-ulitsa-31820966.html
6 000,Харків,Салтівський,,вул. Гвардійців-Широнінців,Героїв праці,46.0,6.0,36.0,2,5,3,панель,True,,,5,"Здається двокімнатна квартира за адресою Гвардійців широнінців 40д з гарним ремонтом меблями та побутовою технікою , поруч автобус на  та трамвайна зупинка, 10 хвилин до метро Героїв праці або Студентська, поруч  школи та дитячі садочки, стадіон, в дворі  розташовані дитячі майданчики, супермаркети Клас.",50.016538,36.346621,2024-06-26 15:13:30,https://dom.ria.com/uk/realty-dolgosrochnaya-arenda-kvartira-harkov-saltovskiy-gvardeytsev-shironintsev-ulitsa-31463843.html
4 000,Харків,Салтівський,531-ий мікрорайон,вул. Нескорених(Героїв Праці),Героїв праці,30.0,6.0,17.0,1,5,1,панель,True,,True,8,"Сдам 1к квартиру 30 м/кв метро  Геров труда 5-7 минут пешком, улица Героев труда 33Б. В квартире есть все для комфортной жизни : два спальных места, холодильник, стиральная машина-автомат, проектор с WiF и роутером, необходимая мебель. Рядом урбан парк, пешком минут 5, супермаркет, рынок , сеть магазинов, школа, детский садик , очень удобное место для жизни. 
Кухонная утварь, посуда, техника. По желанию можно привезти мультиварку, комбайн и т.д. Можно с животными. 1 этаж, подвал прямо в подъезде, есть бомбоубежище.",50.022364,36.356221,2024-06-25 17:14:33,https://dom.ria.com/uk/realty-dolgosrochnaya-arenda-kvartira-harkov-531yiy-mikrorayon-eoev-da-lia-30745930.html
3 500,Харків,Слобідський,,просп. Героїв Харкова(Московський),Захисників України,32.0,2.0,18.0,1,3,3,кирпич,True,ЖК Парковий квартал,,10,"ЖК Парковий Квартал, з ремонтом, дворівнева, піша хода до м.Захисників України та завод Малишева. Укомплектована необхідними меблями та технікою. Для однієї людини, пари можна з дитиною. Оплачуються лише лічильники світла та води.",49.98159013,36.27660806,2024-06-24 13:39:22,https://dom.ria.com/uk/realty-dolgosrochnaya-arenda-kvartira-harkov-slobodskoy-geroev-harkova-moskovskiy-prospekt-31803460.html
5 000,Харків,Немишлянський,,просп. Героїв Харкова(Московський),Армійська,42.0,,,2,5,1,кирпич,True,,,8,"Сдам свою 2 комн. кв. метро Армейская 2 минуты .1/5 дома.Квартира в хорошем состоянии, есть вся необходимая мебель и бытовая техника, новые металлопластиковые окна, двойная дверь.Рядом есть парк  и магазины.Для семьи на длительный срок. Вода, газ по счетчику .Цена 5000.",49.961035,36.337341,2024-06-23 10:51:22,https://dom.ria.com/uk/realty-dolgosrochnaya-arenda-kvartira-harkov-nemyshlyanskiy-geroev-harkova-moskovskiy-prospekt-27859634.html
6 000,Харків,Київський,,вул. Нескорених(Героїв Праці),Героїв праці,40.0,9.0,20.0,1,16,10,панель,True,,,14,"Первый двор от метро, свежий евроремонт, полностью укомплектована мебелью и техникой, для одного человека или пары. Дополнительно оплачиваются коммунальные услуги.",50.02465456,36.3316311,2024-06-22 20:09:00,https://dom.ria.com/uk/realty-dolgosrochnaya-arenda-kvartira-harkov-kievskiy-geroev-truda-ulitsa-31797733.html
5 000,Харків,Салтівський,,вул. Гарібальді,,52.0,10.0,30.0,2,16,6,панель,True,,,13,"Квартира з капітальним ремонтом, в тихому районі, 2 балкони, повністю укомплектована меблями та технікою для сім'ї, пари, без тварин.",50.004809,36.356241,2024-06-21 15:10:18,https://dom.ria.com/uk/realty-dolgosrochnaya-arenda-kvartira-harkov-saltovskiy-garibaldi-ulitsa-25908768.html
5 500,Харків,Немишлянський,,вул. Каденюка(Танкопія),,32.0,7.0,25.0,1,5,1,кирпич,True,,,5,"1-ком по ул.Танкопия, 31. Теплый кирпичный дом. Высокий перый этаж (над цокольным, ).
Укомплектована необходимой мебелью и техникой.
2 спальных места (один диван можно убрать по договоренности).
Аренда 5500грн+комуналка.",49.9536038,36.333561,2024-06-20 16:21:57,https://dom.ria.com/uk/realty-dolgosrochnaya-arenda-kvartira-harkov-nemyshlyanskiy-kadenyuka-tankopiya-ulitsa-31784195.html
6 000,Харків,Шевченківський,,просп. Людвіга Свободи,Перемога,36.0,7.0,17.0,1,9,3,панель,True,,,10,"Сдам 1 комнатную квартиру на Алексеевке, пр.Победы, 46Б. Капитальный ремонт. 2-х балконка, балконы застеклены.
МПО. Встроенная кухня. В наличии мебель и техника.",50.05620746,36.20793652,2024-06-20 12:12:14,https://dom.ria.com/uk/realty-dolgosrochnaya-arenda-kvartira-harkov-shevchenkovskiy-lyudviga-svobody-prospekt-31774772.html
5 000,Харків,Шевченківський,,вул. Енвера Ахсарова,Олексіївська,45.0,6.0,,2,12,5,панель,True,,,7,"Ахсарова 13, тепла, світла квартира. Від власника. Метро 2 хвилини. Поруч ліс та вся інфраструктура. Меблі та все необхідне для проживання є. Зараз вільна. Від одного року.",50.050395,36.210102,2024-06-20 12:08:04,https://dom.ria.com/uk/realty-dolgosrochnaya-arenda-kvartira-harkov-shevchenkovskiy-envera-ahsarova-ulitsa-31751270.html
2 500,Харків,Київський,Салтівка,пров. Шевченківський,Академіка Павлова,19.0,,16.9,1,5,4,кирпич,False,,,8,"Сдам реальную 1-комн. квартиру возле метро Академика Павлова "" Воробьевы Горы"". Этаж 4/5. Холодильник, телевизор, водонагреватель, микроволновка, духовой шкаф. Раскладывающийся диван, встроенный шкаф.
Цена- 2500 грн+ коммунальные платежи.
Без животных! XXX-XXX-XX-XX, XXX-XXX-XX-XX",50.01174966,36.30396458,2024-06-19 15:22:36,https://dom.ria.com/uk/realty-dolgosrochnaya-arenda-kvartira-harkov-saltovka-evenkovkiy-peelok-26487769.html
17 000,Харків,Київський,,вул. Ярослава Мудрого,Пушкінська,111.0,19.2,58.0,2,12,10,монолитный железобетон,False,,True,10,"Здам свою 2-кімнатну квартиру в елітному будинку (10 поверх, зверху ще техповерх.
Метро Пушкінська.
Стіни будинку - міцний монолітний каркас бетон, з утепленням.
Світла, чиста, доглянута та тепла квартира. Великий хол, велика вітальня, кімнати окремі. Квартира оснащена всією побутовою та кухонною технікою, зручними меблями та вбудованими шафами.
Гарний вид вікна, вікна на південній стороні.
Будинок охороняється, відеонагляд, закрита територія, підземний паркінг.
У будинку першому поверсі продуктовий маркет.
Інтелігентні сусіди.
Транспорт, магазини, кафе, ресторани, парк - поруч, у пішій доступності.",50.0038414,36.24561995,2024-06-19 14:37:42,https://dom.ria.com/uk/realty-dolgosrochnaya-arenda-kvartira-harkov-kievskiy-yaroslava-mudrogo-ulitsa-24638872.html
7 500,Харків,Слобідський,,вул. Георгія Тарасенка(Плеханівська),Спортивна,40.0,20.0,35.0,1,16,14,кирпич,True,ЖК Металіст,,8,"Здам Євродвушку в новобудові ЖК Металіст. 2 зупинки метро від центру міста. 
Метро поряд з будинком 2 хв. У кроковій доступності Супермаркети, найдешевший Кінний ринок.

В квартирі 2 кімнати (кухня-студія та спальня). У кухні вітальні меблі з натуральної шкіри, лоджія.
Охайний підʼїзд, паркувальне місце.",49.97768609,36.26459129,2024-06-19 14:24:18,https://dom.ria.com/uk/realty-dolgosrochnaya-arenda-kvartira-harkov-slobodskoy-georgiya-tarasenko-plehanovskaya-ulitsa-31721229.html
7 000,Харків,Шевченківський,,вул. Енвера Ахсарова,Олексіївська,45.0,7.0,38.0,2,12,1,,True,,,10,"Сдам 2 комнатную квартиру на Алексеевке, ул.Ахсарова, 13. Капитальный ремонт. МПО.
В сан узле современная плитка. Встроенная кухня.
Мебель и техника.",50.050395,36.210102,2024-06-19 11:10:50,https://dom.ria.com/uk/realty-dolgosrochnaya-arenda-kvartira-harkov-shevchenkovskiy-envera-ahsarova-ulitsa-31770795.html
7 500,Харків,Шевченківський,,просп. Перемоги,Перемога,65.0,7.0,44.0,3,9,5,панель,True,,,14,"Сдам 3 комнатную квартиру на Алексеевке, по.Победы, 65. Рядом с с/м Рост и АТБ.
Квартира с капитальным ремонтом.
Натяжной потолок, балкон застеклен. МПО.
Комнаты укомплектованы современной мебелью. Встроенная кухня.
Бытовая техника: холодильник, стиральная машина автомат, телевизор. Бойлер.
Комнаты раздельные!
Квартира свободна и готова к заселению!",50.063106,36.203146,2024-06-18 19:38:59,https://dom.ria.com/uk/realty-dolgosrochnaya-arenda-kvartira-harkov-shevchenkovskiy-pobedy-prospekt-31764552.html
5 000,Харків,Салтівський,,вул. Академіка Павлова,Студентська,32.0,8.0,17.0,1,12,5,панель,True,,,13,"Второй дом от метро, евроремонт, полностью укомплектована мебелью и техникой, для одного человека или пары, без животных. Дополнительно оплачиваются коммунальные услуги.",50.01366494,36.32685373,2024-06-18 12:53:19,https://dom.ria.com/uk/realty-dolgosrochnaya-arenda-kvartira-harkov-saltovskiy-akademika-pavlova-ulitsa-31763971.html
7 000,Харків,Шевченківський,,просп. Людвіга Свободи,Олексіївська,65.0,7.0,38.0,3,16,3,панель,True,,,9,"Сдам 3 комнатную квартиру на Алексеевке, пр.Л.Свободы, 36А. До м.Алексеевская 3 минуты.
Квартира с ремонтом. МПО. Сан узел раздельный, установлены стиральная машина автомат и бойлер.
Встроенная кухня. Холодильник, стиральная машина автомат.
Квартира полностью меблирована.
Одна комната проходная, две изолированы с балконами.",50.05204416,36.20829148,2024-06-17 19:15:18,https://dom.ria.com/uk/realty-dolgosrochnaya-arenda-kvartira-harkov-shevchenkovskiy-lyudviga-svobody-prospekt-31759208.html
3 799,Харків,Немишлянський,Нові Дома,вул. Ньютона,Палац спорту,28.0,6.0,,1,5,5,кирпич,True,,,9,"Здам свою 1-шу квартиру, житловий стан. Ремонт часів 90-х. Тепла, економна за комунальними платежами.",49.94002018,36.30617299,2024-06-17 17:32:29,https://dom.ria.com/uk/realty-dolgosrochnaya-arenda-kvartira-harkov-novyie-doma-ona-lia-26291039.html
4 500,Харків,Холодногірський,Залютино,вул. Сергія Борзенка,Холодна гора,40.0,7.0,,1,9,9,кирпич,True,,,12,"1-ком 9/9 с двумя балконами по ул.Борзенко, 2 на Залютино.
Укомплектована необходимой мебелью и техникой: холодильник, микроволновка, электрочайник, стиралка, газовая печь, вытяжка.
Квартира просторная, светлая и теплая.
Аренда 4500грн+счётчики.",49.98513386,36.15903899,2024-06-17 15:30:15,https://dom.ria.com/uk/realty-dolgosrochnaya-arenda-kvartira-harkov-zalyutino-borzenko-ulitsa-28333761.html
4 500,Харків,Київський,,вул. Козакевича,Академіка Павлова,20.0,4.0,,1,9,4,кирпич,True,Птичка,,13,"Уютная 1ком студия 20м в Новострое ЖК Птичка, 4/9 ул.Казакевича, 27. 
Кирпичный дом, лифт.
Укомплектована необходимой мебелью и техникой: 
Диван, шкаф-купе, встроенная кухня;
Телевизор, холодильник, печь, микроволновка, стиралка, кондиционер, бойлер.
Рядом метро А.Павлова, Барабашово, супермаркеты магазины, зона отдыха, река.
Аренда 4.5тыс+коммуналка.",50.01259549,36.30774558,2024-06-17 15:21:48,https://dom.ria.com/uk/realty-dolgosrochnaya-arenda-kvartira-harkov-kievskiy-kozakevicha-ulitsa-27992713.html
4 500,Харків,Київський,Салтівка,вул. Ковалівська(Бестужева),Академіка Барабашова,20.0,4.0,,1,7,5,кирпич,True,ЖК Бестужевські сади,,16,"Затишна 1ком студія 20м в Новобуді ЖК Бесстужевські Сади, 5/9 вул.Бесстужева, 11.
Закритий двір, територія, що охороняється.
Цегляний будинок, ліфт.
Укомплектована необхідними меблями та технікою:
Диван, шафа-купе, вбудована кухня;
Телевізор, холодильник, піч, мікрохвильова піч, пралка, кондиціонер, бойлер.
Поруч метро Барабашово, Метробудівників. Поруч ринок, супермаркети магазини, зона відпочинку, річка.
Оренда 4.5тис+комуналка.",49.99287756,36.28267883,2024-06-17 15:21:32,https://dom.ria.com/uk/realty-dolgosrochnaya-arenda-kvartira-harkov-saltovka-bestujeva-ulitsa-27992599.html
