price_UAH,city,main_area,second_area,street_name,subway,total_square,kitchen_square,living_square,rooms,total_floors,flat_floor,wall_type,checked_apartment,newbuild_name,animal,photo_counts,description,latitude,longitude,date,url
7 000,Харків,Шевченківський,Шатилівка,вул. Серпова,Наукова,31.0,,,1,16,8,монолитно-каркасный,True,ЖК Квант,,8,"Здам 1кв.6/9в центрі Харкова, м. Наукова, кухня-студія, площа 31м2.хороший будинок з охороною і хорошими сусідами, парковка у дворі.",50.01418587,36.23172803,2024-11-21 16:01:52,https://dom.ria.com/uk/realty-dolgosrochnaya-arenda-kvartira-harkov-shatilovka-serpovaya-ulitsa-32475666.html
9 500,Харків,Шевченківський,Шатилівка,вул. Серпова,Наукова,48.0,12.0,,2,16,8,монолитно-каркасный,True,ЖК Квант,,14,"Кухня-студія і спальня в Центрі Харкова, м.Наукова, в житловому комплексі з охороною і хорошими сусідами, ціна на місяць 9500+ все за квитанціями.",50.01384092,36.23197613,2024-11-21 15:55:50,https://dom.ria.com/uk/realty-dolgosrochnaya-arenda-kvartira-harkov-shatilovka-serpovaya-ulitsa-32475602.html
5 000,Харків,Салтівський,,вул. Бучми,Героїв праці,45.0,6.0,30.0,2,5,1,панель,True,,,19,"Дуже приємна квартира з ремонтом. Все зроблено для Вашого комфорту.
Поруч зупинка транспорту, супермаркет, ринок, аптеки, салон краси, зелена зона.
Зручний поверх",50.022945,36.373413,2024-11-21 13:57:03,https://dom.ria.com/uk/realty-dolgosrochnaya-arenda-kvartira-harkov-saltovskiy-buchmy-ulitsa-32480264.html
2 999,Харків,Салтівський,,вул. Академіка Павлова,Студентська,45.0,8.0,30.0,2,12,5,панель,True,,,10,"Гарна 2-х кімнатна кіартира біля метро Студенська. Поруч супермаркет АТБ,  ринок,  Нова Почта,  фітнес-клуб Авокадо,  салон краси,  Укрпошта та усе необхідне.",50.01915565,36.33265165,2024-11-21 12:16:57,https://dom.ria.com/uk/realty-dolgosrochnaya-arenda-kvartira-harkov-521-yy-mikrorayon-akademika-pavlova-ulitsa-32480090.html
2 500,Харків,Салтівський,,вул. Нескорених(Героїв Праці),Салтівська,63.0,7.0,40.0,3,9,4,панель,True,,,10,"Здаю 2-і кімнати в 3-х кімнатній квартирі, одна кімната буде закрита, за домовленістю можна знімати і її, на Салтовці, перехрестя вулиць.Героїв Праці та ін.Тракторобудівників. вул.Героїв Праці 47а. Квартира здається з частковою технікою, меблі завеземо по домовленності . Є кондиціонер, бойлер, посудомийна машина. Кімнати роздільні, в квартирі зроблено хороший ремонт. Є кутовий диван. Поруч з будинком зупинка транспорту, магазини, кіоски, кафе, Інтернет проведено, є wifi-роутер. Хороший, Тихий район. Окремо потрібно оплачувати ком.послуги.",50.017778,36.366547,2024-11-21 10:49:04,https://dom.ria.com/uk/realty-dolgosrochnaya-arenda-kvartira-harkov-saltovskiy-neskorenyh-geroev-truda-ulitsa-32479873.html
5 400,Харків,Шевченківський,2-ий мікрорайон,вул. Тобольська,23 Серпня,48.0,70.0,52.0,2,5,3,кирпич,True,,,16,"Комфортна затишна квартира, новий ремонт, меблі, техніка. Зелений двір, поряд метро, магазини, зелена зона. Газ та електріку сплачуєте за лічільниками, встановлений електролічільник день-ніч дозволяє значно економіти (нічний тариф 50%).Велика кладовка для зберігання речей",50.029536,36.217198,2024-11-20 17:16:35,https://dom.ria.com/uk/realty-dolgosrochnaya-arenda-kvartira-harkov-2-oy-mikrorayon-tobolskaya-ulitsa-32475257.html
7 000,Харків,Шевченківський,,пров. Отакара Яроша,Ботанічний сад,45.0,15.0,20.0,1,17,6,монолитно-каркасный,True,ЖК Оптима,True,8,"Без комісії! Реальна! Павлово поле! Метро Ботанічний сад 5 хвилин пішки.
Перевулок Отакара Яроша, будинок 22.

Здаю 1-кімн.з.квартиру. Заселений новобудови ""Оптима"".
Поверх 6/16, будинок цегляний, капітальний ремонт, МПО.
Є вся меблі, і техніка для проживання: двокамерний холодильник, телевізор, пральня-автомат, бойлер, кондиціонер.Сан. вузол суміжний - встановлена душова кабіна
Квартира без балкона або лоджії.

Можна з тваринами.

Ціна: 7 000 грн. + к/у.",50.025119,36.21738,2024-11-20 17:10:44,https://dom.ria.com/uk/realty-dolgosrochnaya-arenda-kvartira-harkov-shevchenkovskiy-otakara-yarosha-pereulok-32188468.html
8 000,Харків,Київський,,вул. Новоолександрівська,,52.0,10.0,30.0,2,5,3,кирпич,True,ЖК Журавлівський,True,11,"Закритий комплекс, з охороною, відеоспостереження, зона відпочинку, магазини, парикмахерська і кафе на території. Свіжий євроремонт, автономне опалення, повна комплектація. Можна дрібна вихована тварина. Додатково оплачуються комунальні за лічильниками.",50.01361023,36.27715155,2024-11-20 14:57:19,https://dom.ria.com/uk/realty-dolgosrochnaya-arenda-kvartira-harkov-juravlevka-novoaleksandrovskaya-ulitsa-32476266.html
3 000,Харків,Слобідський,Нові Дома (Слобідський),вул. Каденюка(Танкопія),Палац спорту,31.0,6.0,17.0,1,5,3,панель,True,,,10,"Здається в оренду на довгий термін однокімнатна квартира. Район Нові Будинки, метро Палац Спорту. вул. Каденюка ( Танкопія), 24. Поверх 3/5.

  Оренда + ком.платежі ( ОПАЛЕННЯ 50/50)

Санвузол суміжний, є пральна машина автомат. У кімнаті диван ( розкладний), крісло, є великий сервант/шафа. 
Вікна металлопластикові, балкон заскляний. Є телевізор ( старенький).

Квартира з гарним косметичним ремонтом, встановлені нові радіатори. Лічильник лише на світло 
Без хатніх тваринок. 

Зручне розташування будинку: є зупинка громадського транспорту ( їхати до метро Палац Спорту 3 зупинки).",49.952518,36.321084,2024-11-20 14:49:42,https://dom.ria.com/uk/realty-dolgosrochnaya-arenda-kvartira-harkov-novye-doma-slobodskoy-kadenyuka-tankopiya-ulitsa-32476294.html
2 000,Харків,Салтівський,,вул. Світла,Героїв праці,31.0,6.0,18.0,1,5,2,панель,True,,,7,"Здаю 1к.кв. на Салтовці, , вулиця Світла, 10 хвилин від метро ""Г.Труда"", 2/5, чистий житловий стан. Є все необхідне для життя. Вільна. 2000гр+ КУ",50.02147,36.375114,2024-11-20 14:40:45,https://dom.ria.com/uk/realty-dolgosrochnaya-arenda-kvartira-harkov-saltovskiy-svetlaya-ulitsa-32433472.html
5 000,Харків,,,вул. Академіка Барабашова,,40.0,,,1,9,5,,True,,True,7,"Затишна однокімнатна квартира в центрі Харкова на 5 поверсі 9-поверхового будинку. Площа 40 кв. м. Відмінний варіант для однієї або двох осіб. Квартира знаходиться в живописному місці поруч зі всіма необхідними магазинами, кафе та парками. Ідеальний вибір для комфортного проживання в місті.",50.01260595,36.30492422,2024-11-20 11:34:37,https://dom.ria.com/uk/realty-dolgosrochnaya-arenda-kvartira-harkov-akademika-barabashova-ulitsa-32475288.html
4 100,Харків,Салтівський,521-ий мікрорайон,вул. Валентинівська,Студентська,45.0,8.0,30.0,2,9,6,панель,True,,True,21,"Приємна квартира біля метро Студенська.
Поруч супермаркети та магазини. Ринок,  Нова Пошта,  салони краси,  аптеки та усе,  що необхідне. Зупинка біля дому. Метро 5 хв.",50.014818,36.337876,2024-11-14 12:58:29,https://dom.ria.com/uk/realty-dolgosrochnaya-arenda-kvartira-harkov-521-yy-mikrorayon-valentinovskaya-ulitsa-32449593.html
3 000,Харків,Салтівський,,Салтівське шосе,,24.0,2.0,16.0,1,8,4,кирпич,True,,True,6,"ЖК Французький Квартал, поруч транспорт, торговий центр Французький бульвар, студія, обладнана всім необхідним для проживання, можна дрібне виховане тварина, додатково оплачуються комунальні послуги.",49.99032206,36.29239522,2024-11-14 11:19:38,https://dom.ria.com/uk/realty-dolgosrochnaya-arenda-kvartira-harkov-saltovskiy-saltovskoe-shosse-32453898.html
7 000,Харків,Київський,522-ий мікрорайон,вул. Валентинівська,Студентська,65.0,7.5,40.4,3,12,1,панель,False,,,9,"Здам 3 кімнатну квартиру по вулиці Валентинівська 15 тільки на тривалий термін!
1 поверх 12 поверхового панельного будинку 65 кв. метрів квадратних.
Перебувати безпосередньо біля метро Студентська, дуже зручно.
Три кімнати. Вікна замінені на енергозберігаючі.
У двох кімнатах великі двоспальні ліжка з ортопедичним матрацами.
Сантехніка в хорошому стані.
Є бойлер! Ергономічна кухня.
Одна кімната виходить на схід сонця, інші дві виходять на захід і в бік річки, там де багато природи і чистіше повітря.
Захист від спалахів напруги на всю квартиру;
Лічильник на воду і електрику.
Додаткові фото та відео надішлю в личку.
Оренда + світло та вода по лічільнику.
Після підписання договору залишаєте заставну суму, яка повертається після закінчення договору (це не оплата останнього місяця, а заставу)
На всі доп. питання відповідаю тільки по телефону. Дивитися в будь-який зручний час для вас",50.01901592,36.32621133,2024-11-13 21:21:35,https://dom.ria.com/uk/realty-dolgosrochnaya-arenda-kvartira-harkov-522-yy-mikrorayon-valentinovskaya-ulitsa-32452505.html
4 999,Харків,Салтівський,,вул. Нескорених(Героїв Праці),Героїв праці,48.0,8.0,30.0,2,9,6,панель,True,,,21,"Аренда затишної  квартири. Дуже приємна та охайна квартира. Є все необхідне для комфортного проживання. Нічого зайвого! Спокійні, інтелегентні сусіди, приємний двір, є місце для авто. Поруч супермарке, базарчик, банк, аптека, зупинки громадсько транспорту, метро 5 хвилин!",50.022469,36.34427,2024-11-13 20:47:49,https://dom.ria.com/uk/realty-dolgosrochnaya-arenda-kvartira-harkov-saltovskiy-neskorenyh-geroev-truda-ulitsa-32452508.html
6 500,Харків,Київський,Дальня Журавлівка,вул. Борткевича,Київська,36.8,8.2,18.0,1,9,6,кирпич,False,ЖК Гідропарк,,18,"На тривалий термін пропоную в оренду 1 кім. квартиру з видом на річку, ліс за адресою вул. Борткевича, 9, ЖК Гідропарк. Загальна площа 40 кв. м., 6/9 поверх. Квартира тепла та затишна, укомплектована необхідними меблями та технікою для комфортного проживання. Виконан гарний та якісний ремонт. Великий місткий гардероб. Є лічильник з опалення на квартиру, що дуже зручно самім редагувати тепло і гроші. Розвинута інфраструктура. Поруч зупинка трамвая, автобусна зупинка, з якою ви можете дістатися до м. Героїв Праці, м. Київської 10 хвилин. Зелена зона, річка, екологічно чистий район.
6500грн/міс+дод. плата за комунальні. послуги. Квартира здається з 16 листопада",50.02212549,36.29452081,2024-11-13 19:40:39,https://dom.ria.com/uk/realty-dolgosrochnaya-arenda-kvartira-harkov-dalnyaya-juravljovka-bortkevicha-ulitsa-32377138.html
5 500,Харків,Київський,Салтівка,Салтівське шосе,Академіка Барабашова,41.8,9.7,19.7,1,9,4,кирпич,False,ЖК Салтовський,,17,"Здам в оренду велику простору однокімнатну квартиру, найкращий 4 поверх, новобуд, Салтівське шосе 264, квартира з ремонтом, меблями, технікою, не кутова. Загальна площа 42м2, кухня 11м2 із виходом на великий балкон.
Встановлено лічильники на тепло, воду. газ. Новобуд із газом. Квартира дуже тепла і що важливо із мінімальними платежами за опалення взимку.
Просторий двір для автостоянки, завжди є місце де припаркуватися.",49.98824982,36.36229557,2024-11-13 15:17:09,https://dom.ria.com/uk/realty-dolgosrochnaya-arenda-kvartira-harkov-saltovka-saltovskoe-shosse-32429914.html
3 900,Харків,Київський,Салтівка,просп. Ювілейний,Академіка Барабашова,40.0,10.0,20.0,1,5,1,панель,True,,,17,"Приємна 1-кімнатна квартира з ремонтом, з прибудовим, яка приєднана до квартири, перепланування, кімната збільшена 22м2, кухня збільшена 10м2, хороший дорогий диван підходить і для високих людей!
Поруч магазини, ринок, пошта, ТРК Україна і все що необхідно.
Поруч з парком.
Метро в пішій доступності.",49.995780836559106,36.32489948812386,2024-11-13 14:39:05,https://dom.ria.com/uk/realty-dolgosrochnaya-arenda-kvartira-harkov-saltovka-yubileynyy-prospekt-32441647.html
5 000,Харків,Слобідський,Нові Дома (Слобідський),просп. Григоренка Петра,,49.1,5.4,30.0,2,5,4,панель,False,,,11,"Здам 2 кімнатну квартиру на довготривалий термін по проспекту Петра Грігоренко 10б.
Квартира знаходиться на 4 поверсі 5-поверхового панельного будинку, квартира світла, тепла, простора в відмінному місці розташування і хорошої загальною площею 49 кв. м. Тихий спокійний район для проживання Відмінна інфраструктура. Зупинка транспорту поруч, до метро Палац Спорту 4 зупинки на тролейбусі. Квартира в житловому стані. Кімнати окремі. Встановлено котел, є пральна машина-автомат, холодильник Здаємо порядним орендарям.Оплат 5000 гривень плюс оплата за лічильниками вода. світло,  Перший і останній місяць Оплата послуг АН при вселенні .Подивитися в будь-який зручний час для вас.",49.952571,36.313058,2024-11-13 13:29:15,https://dom.ria.com/uk/realty-dolgosrochnaya-arenda-kvartira-harkov-novye-doma-slobodskoy-grigorenko-petra-prospekt-32449760.html
3 500,Харків,Київський,,вул. Козакевича,Академіка Павлова,35.0,10.0,20.0,1,9,3,кирпич,True,ЖК Птичка,,19,"Приємна квартира з новим ремонтом у новому домі. 

Все зроблено гарно,  як для себе. Уся техника нова. 

Зручний 3-й прверх!",50.012502,36.306969,2024-11-13 10:04:34,https://dom.ria.com/uk/realty-dolgosrochnaya-arenda-kvartira-harkov-kievskiy-kozakevicha-ulitsa-32441581.html
2 999,Харків,Салтівський,,вул. Глобинська(Маршала Батицького),,42.0,6.0,30.0,2,9,7,кирпич,True,,,14,"Сдам 2к біля метро Турбоатом. Квартира укомплектована всім необхідним для комфортного проживання. Оплата за перший місяць +заставна вартість + послуги  АН.
О",49.98311567,36.30654793,2024-11-12 19:01:43,https://dom.ria.com/uk/realty-dolgosrochnaya-arenda-kvartira-harkov-saltovskiy-globinskaya-marshala-batitskogo-ulitsa-32447165.html
5 500,Харків,Немишлянський,Нові Дома,вул. Каденюка(Танкопія),Палац спорту,47.0,,,2,5,2,панель,True,,True,9,Сдам свою 2 кімнатну квартиру состояние гарне косметіка в квартіре е холодильник пральна машина мікроволновка всі подробиці по телефону,49.953663,36.308769,2024-11-11 16:22:28,https://dom.ria.com/uk/realty-dolgosrochnaya-arenda-kvartira-harkov-novye-doma-kadenyuka-tankopiya-ulitsa-20541798.html
5 500,Харків,Київський,Нагірний (Київський),вул. Каразіна,Пушкінська,55.1,7.8,35.3,2,5,3,силикатный кирпич,False,,,8,"Продам 2к. кв. за адресою Каразіна, 13. Центр. 3 поверх 5 поверхового будинку. 55 м2. Квартира з ремонтом. Меблі частково, все що на фото. Квартира чиста і затишна . Приватний двір. Вартість оренди 5500+ комунальні послуги. Фото відповідають дійсності. Квартира знаходиться в центрі, вся інфраструктура поруч. Вітається довгострокова оренда. Зв'яжіться за телефоном АН Аверс Наталія",50.00726261,36.24332958,2024-11-11 15:25:08,https://dom.ria.com/uk/realty-dolgosrochnaya-arenda-kvartira-harkov-nagornyy-kievskiy-karazina-ulitsa-32438864.html
5 000,Харків,Шевченківський,Олексїївка,просп. Перемоги,,43.0,11.7,20.2,1,9,8,кирпич,False,ЖК Перемоги,True,10,"1 кімнатна квартира
Перемоги 85
8 / 9 поверх
41 м
5 т+ комунальні
XXXXXXXXXX",50.070429,36.211512,2024-11-10 22:36:52,https://dom.ria.com/uk/realty-dolgosrochnaya-arenda-kvartira-harkov-alekseevka-pobedy-prospekt-32436719.html
7 500,Харків,Салтівський,608-ий мікрорайон,вул. Академіка Павлова,Студентська,63.8,0.0,42.8,3,9,2,панель,False,,,9,"Оренда від власника! Не потрібно платити комісію агенству нерухомості! 
3-х кімнатна квартира з євроремонтом! 608 м.р. Салтівка. Вул. Ак. Павлова, буд. 140- В.  Внутрішній затишний та безпечний двір. До станції метро Героїв праці та Студентська 3 хвилини пішки. Другий поверх/9. Квартира повністю укомплектована сучасною технікою та меблями. Ми не проти маленьких дітей, є в тому числі дитячі ліжка. Однак, просимо без тваринок. Довгострокова оренда. 7.500 грн+ комунальні. Прошу дзвонити, писати на Вайбер, Телеграм",50.0190076,36.33421112,2024-11-10 12:00:09,https://dom.ria.com/uk/realty-dolgosrochnaya-arenda-kvartira-harkov-608y-mikrorayon-kademika-avlova-lia-25712799.html
3 500,Харків,Салтівський,,вул. Світла,Героїв праці,62.5,5.4,44.4,3,5,2,,False,,,13,"Здається 3-к квартира в 533 м-не Салтовки, вулиця Світла, метро Салтовська
Комфортний 2/5 поверх, планування окрема
Хороший житловий стан, виконаний косметичний ремонт, встановлені МПО.
Є всі необхідні меблі та побутова техніка, крім пральної машини.
Зручне розташування, поруч дитячі заклади і супермаркет, ринок, зупинка маршруток.
Чистий закритий підхід, порядні сусіди.
Ціна 3500 грн і світло вода по - лічильникам.
Оплата за фактом поселення
Наша тепла і затишна квартира чекає свого турботливого орендаря",50.019712,36.368933,2024-11-10 00:34:18,https://dom.ria.com/uk/realty-dolgosrochnaya-arenda-kvartira-harkov-saltovskiy-svetlaya-ulitsa-32434989.html
3 000,Харків,Салтівський,521-ий мікрорайон,вул. Гвардійців-Широнінців,Студентська,54.0,8.0,36.0,2,9,5,,True,,True,15,"Аренда затишної двокімнатної квартири. Дуже приємна та охайна квартира. Є все необхідне для комфортного проживання. Нічого зайвого! спокійні, інтелегентні сусіди, приємний двір, є місце для авто. Поруч супермарке, базарчик, банк, аптека, зупинки громадсько транспорту, метро 5 хвилин!",50.01521742,36.34203347,2024-11-09 21:31:05,https://dom.ria.com/uk/realty-dolgosrochnaya-arenda-kvartira-harkov-521-yy-mikrorayon-gvardeytsev-shironintsev-ulitsa-32435411.html
4 000,Харків,Салтівський,521-ий мікрорайон,вул. Академіка Павлова,Героїв праці,45.0,8.0,30.0,2,12,6,панель,True,,True,17,"2 кімнатна квартира біля метро.
Хороший житловий стан, вбудована кухня, широке ліжко, диван.
Хороше розташування, поруч ЧудоМаркет, с/м АТБ, ринок, вся інфраструктура, салони краси, аптеки і все, що необхідно для життя.
Метро 1 хвилину пішки.",50.02216488,36.33508651,2024-11-09 15:11:13,https://dom.ria.com/uk/realty-dolgosrochnaya-arenda-kvartira-harkov-521-yy-mikrorayon-akademika-pavlova-ulitsa-32434074.html
