price_UAH,city,main_area,second_area,street_name,subway,total_square,kitchen_square,living_square,rooms,total_floors,flat_floor,wall_type,checked_apartment,newbuild_name,animal,photo_counts,description,latitude,longitude,date,url
3 700,Харків,Салтівський,,вул. Ковалівська(Бестужева),Захисників України,19.0,4.0,16.0,1,6,1,кирпич,True,ЖК Бестужевські сади,,8,"11Хозяин сдаст в аренду   порядочным и аккуратным квартиросъёмщикам(без вредных привычек) , без животных и маленьких детей чистую и уютную квартиру гостиничного типа S=19m2.    1/6;В  ЖК *Бестужевские Сады*.(Ул. Бестужева 11).Дом имеет свою огороженную, и благоустроенную территорию с видеонаблюдением.
В 5мин.пешего хода ТРЦ ""Французкий бульвар"", в котором есть все необходимое для покупок и досуга.МПО,  вместительный шкаф купе, бойлер.В кв.имеется::.телевизор, ст.машина
, кондиционер, широкий 2 х.спальный диван, холодильник, микроволновка, утюг, гладильная доска, сушилка для белья, необходимая посуда.Проведен интернет и кабельное.
Оплата:3700+коммунальные, 1-й и последний месяц.Квартира свободна",49.9926043557096,36.28314321313073,2025-01-24 19:01:27,https://dom.ria.com/uk/realty-dolgosrochnaya-arenda-kvartira-harkov-saltovskiy-kovalevskaya-bestujeva-ulitsa-32686408.html
15 000,Харків,Новобаварський,,вул. Паращука Юрія,Холодна гора,67.0,10.0,66.0,3,10,2,кирпич,True,,,19,"Квартира з капітальним  ремонтом 2022 року, перша здача. У будинку є укриття. Квартира дуже тепла та світла.",49.97920239,36.1842842,2024-12-08 23:34:03,https://dom.ria.com/uk/realty-dolgosrochnaya-arenda-kvartira-harkov-novobavarskiy-paraschuka-yuriya-ulitsa-31640241.html
8 000,Харків,Шевченківський,Центр,вул. Григорія Сковороди(Пушкінська),Архітектора Бекетова,69.0,9.0,,3,5,3,кирпич,True,,,12,"Сдам 3 к.кв. в самом Центре, ул. Пушкинская, 40, м. Арх. Бекетова в двух шагах.

3/5 эт. 69 м2. Все комнаты раздельные.

Квартира после ремонта, укомплектована мебелью и бытовой техникой. 2 ТВ, холодильник, кондиционер, микроволновка, стиральная машинка автомат.

Рядом вся инфраструктура.",49.99753778,36.23979083,2025-01-25 15:18:54,https://dom.ria.com/uk/realty-dolgosrochnaya-arenda-kvartira-harkov-tsentr-grigoriya-skovorody-pushkinskaya-ulitsa-31130884.html
126 600,Харків,,,просп. Тракторобудівників,,48.0,,,2,5,3,панель,True,,,14,"2-кімнатна квартира, з двома роздільними кімнатами. У кожній кімнаті по балкону,  метро Студентська.",50.012198,36.348415,2025-01-25 15:05:33,https://dom.ria.com/uk/realty-dolgosrochnaya-arenda-kvartira-harkov-traktorostroiteley-prospekt-32691747.html
3 300,Харків,Салтівський,,вул. Гарібальді,Студентська,36.0,8.0,20.0,1,9,8,панель,True,,,23,"Сдам 1 комнатную квартиру улучшенной планировки с ремонтом. Возле дома супермаркет АТБ, магазины, Класс.

     Квартира очень теплая, чистая, аккуратная. Просторная комната с раскладным диваном, есть шкафы, письменный стол, огромная утепленная лоджия сделана как вторая комната. Есть вся необходимая бытовая техника- холодильник, стиральная машинка, установлена новая варочная ГАЗОВАЯ поверхность, вытяжка. Также достаточно посуды и постельных принадлежностей, заведен интернет.
     Коммунальные минимальные, есть счетчики на свет и воду.

Квартира свободна, готова к заселению.",50.004694,36.351179,2025-01-25 14:47:11,https://dom.ria.com/uk/realty-dolgosrochnaya-arenda-kvartira-harkov-saltovskiy-garibaldi-ulitsa-32690379.html
9 000,Харків,Немишлянський,,вул. Мельникова Василя,Палац спорту,45.0,7.0,30.0,2,5,2,панель,True,,,17,"Здам двокімнатну квартиру на Нових будинках, вулиця Василя Мельникова 9/1. Формат-кухня студія + спальня. Євроремонт. Меблі, техніка. Цегляний будинок із газом. 9000+ комуналка.",49.96200452,36.32554073,2025-01-25 14:21:55,https://dom.ria.com/uk/realty-dolgosrochnaya-arenda-kvartira-harkov-nemyshlyanskiy-melnikova-vasiliya-ulitsa-31494302.html
3 500,Харків,Шевченківський,,просп. Науки,23 Серпня,32.0,6.0,17.0,1,5,1,панель,True,,,19,"Здається в оренду на довгий термін однокімнатна квартира на 1 поверсі 5-ти поверхового будину. У квартирі газова плита, є бойлер, пральна машина автомат, на вікнах решітки.

Розташована біля метро 23 Серпня ( поруч відділення Нової пошти, продуктовий супермаркет Лео, магазин Вина світу, далі супермаркет Класс, Свіжина, ринок). 

У квартирі є 2 шафи для одяги, кладовка, є інтернет, 2 ліжка, письмовий стіл. Квартира затишна.",50.038494,36.222699,2025-01-25 13:19:06,https://dom.ria.com/uk/realty-dolgosrochnaya-arenda-kvartira-harkov-shevchenkovskiy-nauki-prospekt-32691489.html
12 000,Харків,Шевченківський,337-ий мікрорайон,вул. Енвера Ахсарова,Олексіївська,82.1,15.7,38.2,2,9,3,монолитно-каркасный,False,ЖК Green Town,,15,"Вперше здам в оренду гарну сучасну 2-х кімнатну квартиру 82 м2 в обжитій новобудові Бізнес - класу Green Town. Підземний та наземний паркінги, охороняєма закрита теріторія. Поруч ліс. Метро Олексіївська - 5 хвилин пішки. Поруч супермаркети, ринок, зупинки транспорту, розважальні, учбові та спортивні заклади.
Квартира знаходиться на комфортному 3 поверсі, працює ліфт. Квартир дуже простора, багато повітря, висота стелі - 3 м. Встановлені панорамні вікна, дуже гарний вид у двір та на ліс. В квартирі дві окремі кімнати, два санвузла, простора кухня - студія, дві засклені лоджії. Євроремонт, сучасні меблі. Кухня повністю укомплектована всім необхідним. Встановлено лічильники на все. Телефонуйте! 12000 грн + лічильники.",50.052115,36.20848,2025-01-24 21:02:50,https://dom.ria.com/uk/realty-dolgosrochnaya-arenda-kvartira-harkov-337-oy-mikrorayon-envera-ahsarova-ulitsa-32689211.html
8 000,Харків,Київський,,вул. Академіка Барабашова,Академіка Павлова,88.9,17.4,38.6,2,6,2,кирпич,False,,True,22,"Ваша мечта о комфортном жилье становится реальностью!
Предлагаю вам в долгосрочную аренду 2-комнатную квартиру в новом жилом комплексе ЖК Консоль, м Ак. Павлова 10 минут пешком, ул Барабашова, 30
Комфортный этаж 2/9, площадь 87 м, планировка раздельная, просторная кухня- студия 18м. Застекленная и утеплённая лоджия 10 м с выходами из каждой комнаты обеспечивает вам тепло в зимний период 
В квартире выполнен качественный капитальный ремонт, полностью укомплектована современной стильной и удобной мебелью и техникой!
Есть парковочное место для вашего авто
Тихий спокойный район, благоустроенный двор с детской площадкой
Цена 8000 грн и коммунальные платежи ( отопление 50%)
Эта квартира превращает съемное жилье в дом вашей мечты. Сделайте следующий шаг к вашей комфортной жизни. 
Не упустите этот шанс  свяжитесь со мной прямо сейчас и запишитесь на просмотр!",50.016201,36.3076,2025-01-24 17:39:32,https://dom.ria.com/uk/realty-dolgosrochnaya-arenda-kvartira-harkov-barabashova-ulitsa-26761065.html
5 500,Харків,Салтівський,,просп. Героїв Харкова(Московський),Захисників України,40.0,8.0,21.0,1,10,7,кирпич,True,,,7,"Сдам свою 1 из. кв. рядом м. З. Украины 7/9 кирп, пр. Московский 97, необходимая мебель и техника, бойлер , кондиционер, газ, 5800 грн плюс счет, свободна, показываю с 24 января, пишите , торг возможен",49.99105725,36.25921571,2025-01-24 17:36:07,https://dom.ria.com/uk/realty-dolgosrochnaya-arenda-kvartira-harkov-saltovskiy-geroev-harkova-moskovskiy-prospekt-31984723.html
4 000,Харків,Салтівський,521-ий мікрорайон,вул. Нескорених(Героїв Праці),Салтівська,32.0,8.0,17.0,1,9,1,панель,True,,,8,"Квартира с ремонтом, укомплектована мебелью и техникой, пеший ход до метро, рядом супермаркет, рынок, остановка транспорта. Дополнительно оплачиваются коммунальные услуги.",50.021053,36.341751,2025-01-24 15:38:46,https://dom.ria.com/uk/realty-dolgosrochnaya-arenda-kvartira-harkov-521-yy-mikrorayon-neskorenyh-geroev-truda-ulitsa-32689359.html
5 000,Харків,Слобідський,,бул. Жасминовий,Палац спорту,32.3,5.7,18.6,1,5,5,панель,True,,True,26,"Відмінна пропозиція для РОДИНИ : оренда 1 кімнатної квартири.
Локація: Слобідский рн
Жасміновий бульвар, 
м. Палац Спорту  4 зупинки транспортом., 25 хв пішки. 
*Переваги ОН:5 /5. Зверху техповерх.S=33м2/ кухня =6м2. 
Чудово організований житловий простір в 1к квартирі.
Світла квартира, шафа'купе для зберігання речей, 2хспальне ліжко + розкладний диван - 3 або і 4 спальних місць, письмовий уголок для навчання або роботи.Мебльована кухня, холодильник, пралка, газова плита.
С/в суміжний, чепурний.Заскленний просторий балкон. Лічильників немає, один прописаний.Броньовані двері.Код на під'їзді.
Чепурний , прибраний двір, дитячи майданчики та місця для занять спортом.Зупинки транспорту у багато напрямків міста.
Розвинена інфраструктура району .
Ринок,   супермаркети, 
ліцеї, садочки, алеї відпочинку.
*Важливо: Проживання з тваринками Власники не заперечують .
*Щоб відсвяткувати входини, Вам потрібно: 5 000 грн власнику +сплата комунальних по квитанціях + 5 000 грн заставні (можливо розбити на декілька платежів).+ 50% послуги рієлтора
З повагою Шило Ольга, сертифікована рієлторка СФНУ.",49.947713,36.317906,2025-01-24 14:04:08,https://dom.ria.com/uk/realty-dolgosrochnaya-arenda-kvartira-harkov-slobodskoy-jasminovyy-bulvar-32337319.html
5 000,Харків,Слобідський,Нові Дома (Слобідський),бул. Жасминовий,Палац спорту,32.3,5.7,18.6,1,5,5,панель,True,,,15,"Сдам 1к квартиру м Дворец спорта, Жасминовый б-р, 6б Уютная, светлая, чистая, вам понравится. Меблирована всем необходимым. МПО.  Можно для семьи - имеется двуспальная кровать и раскладной диван. Можно с животными. В подъезде ремонт, МПО. Ухоженный двор. Развитая инфраструктура. До метро   4 остановки, 25 мин пешком. 5000 + коммуналка. Звоните, уточняйте. Предложение от владельца.",49.947713,36.317906,2025-01-24 14:01:18,https://dom.ria.com/uk/realty-dolgosrochnaya-arenda-kvartira-harkov-novye-doma-slobodskoy-jasminovyy-bulvar-32652174.html
4 000,Харків,Новобаварський,,Григорівське шосе,Холодна гора,38.0,6.9,21.9,1,10,6,кирпич,False,,,18,"Без комиссии ! Реальная ! метро Холодная Гора 3 минуты пешком .
Григоровское шоссе , дом 57 .

Сдам 1-комн.из.квартиру . Этаж 6/9 , дом кирпичный , ремонт, МПО . Без балкона - с эркером .
Есть  мебель , и техника для проживания : двухкамерный холодильник , телевизор , стиралка-автомат . Кондиционер .Сан.узел раздельный . Двойная входная дверь.

Цена : 4000 грн. + к.у .",49.98001425,36.1842889,2025-01-24 09:05:53,https://dom.ria.com/uk/realty-dolgosrochnaya-arenda-kvartira-harkov-novobavarskiy-grigorovskoe-shosse-31887253.html
7 500,Харків,Новобаварський,Рубанівка,пров. Титаренківський,Холодна гора,36.0,5.0,30.0,1,5,3,кирпич,True,,,7,"Сдам квартиру студию в новострое 36 кв.м, 3/5 на Холодной горе, переулок Титаренковский 10 А, метро 10 минут, вся развитая инфраструктура в пешей доступности.

Квартира с современным ремонтом, встроенный холодильник, микроволновая печь, духовой шкаф, посудомоечная машина, большой диван, кондиционер, есть небольшая комната можно использовать как кабинет или спальню, балкон, фильтры для воды новые.
Индивидуальное газовое отопление, что экономит коммунальные расходы и горячая вода есть всегда.
Закрытая территория.

7500+ коммунальные услуги ( коммунальные услуги маленькие за счёт индивидуального отопления).

Остались вопросы лучше звоните!",49.9798046,36.19273406,2025-01-23 16:47:06,https://dom.ria.com/uk/realty-dolgosrochnaya-arenda-kvartira-harkov-rubanovka-titarenkovskiy-pereulok-32685031.html
12 000,Харків,Основ’янський,,вул. Георгія Тарасенка(Плеханівська),Левада,80.0,27.0,40.0,2,16,8,кирпич,True,ЖК Плеханівська,,10,"Довгострокова оренда 2к квартири в ЖК Плеханівська
вулиця Плеханівська
Тип будівництва: новобудова
Площа: 80м2/40м2/27м2
Поверх / Поверхів: 8 / 16
Тип стін: цегла
Ремонт: після ремонту

Ексклюзивно в агенції нерухомості SoftLoft. 
Код об'єкту: SL-060560

Ще більше цікавого на нашому сайті SoftLoft
Дізнавайтеся першими про найкращі пропозиції, аналітику ринку та корисні поради для оренди чи купівлі нерухомості. Завітайте на an-softloft  там знайдеться все, що потрібно для прийняття зважених рішень!

Підписуйтесь на наш Telegram-канал ""єКвартира""
Отримуйте актуальні новини, цікаві кейси та гарячі пропозиції просто у вашому смартфоні. Не пропустіть шанс бути на крок попереду!

Будьте з нами  ваш надійний партнер у світі нерухомості!",49.98184883,36.25250075,2025-01-23 15:50:23,https://dom.ria.com/uk/realty-dolgosrochnaya-arenda-kvartira-harkov-osnovyanskiy-georgiya-tarasenko-plehanovskaya-ulitsa-32684616.html
3 500,Харків,Салтівський,,пров. Білостоцький,Академіка Барабашова,22.0,5.0,19.0,1,2,1,кирпич,True,,,12,"Здається дуже затишна квартира біля ТЦ Французький бульвар. Пров Білостоцький 20А. Квартира знаходиться на першому поверсі та має решітки на вікнах. Тепла, затишна, яка має все необхідне для комфортного проживання. Ключі є на руках
 Показуємо в зручний для вас час.
3500 + комунальні послуги.",49.99302522,36.29683415,2025-01-23 15:34:52,https://dom.ria.com/uk/realty-dolgosrochnaya-arenda-kvartira-harkov-saltovskiy-belostokskiy-pereulok-32684505.html
3 900,Харків,Салтівський,,вул. Академіка Павлова,Академіка Павлова,25.0,,,1,2,2,,True,,,16,"Здається в оренду помісячно затишна 1-кімнатна квартира у районі Московський (Салтівський) міста Харків. Нерухомість знаходиться на другому поверсі двоповерхового будинку. Загальна площа 25 м². Це вторинна нерухомість, ідеально підходить для одного мешканця. Чудове розташування забезпечить зручний доступ до всіх необхідних місць, а затишний і комфортний інтер'єр зробить ваше перебування приємним та затишним. У квартирі є все необхідне для комфортного життя.",50.00572634,36.31692886,2025-01-23 13:10:56,https://dom.ria.com/uk/realty-dolgosrochnaya-arenda-kvartira-harkov-saltovskiy-akademika-pavlova-ulitsa-32683573.html
3 000,Харків,Салтівський,,просп. Ювілейний,,44.0,5.3,29.9,2,5,4,панель,False,,,6,"Орендую в оренду 1к. в 2 ком кв, 2я кімната закрита. територіально, в дуже зручному місці, пр. Ювілейний, 34Д, 4/5, площа17/32/6. Район з розвиненою інфраструктурою і чудовою транспортною розв'язкою, поруч зупинки тролейбусів, трамваїв і маршруток, в пішій доступності (або 1 зупинка) метро Барабашово, магазини, АТБ, кіоски, Сільпо, ТРЦ Україна, пошта, поліклініка. Апартамент знаходиться на 4 поверсі, в хорошому житловому стані, 2-3 спальні місця, холодильник, пральна машина. Комунальні платежі оплачуються додатково.",49.995873,36.318644,2025-01-23 12:17:15,https://dom.ria.com/uk/realty-dolgosrochnaya-arenda-kvartira-harkov-saltovskiy-yubileynyy-prospekt-32439045.html
7 000,Харків,Салтівський,,вул. Гвардійців-Широнінців,Салтівська,68.5,7.5,43.6,3,9,6,панель,False,,,16,"Вперше здам в оренду затишну сімейну квартиру 70 м2 в будинку поліпшеного планування, вул. Гвардійців Широнинців, 93. Поруч джерело питної води, магазини, зупинка транспорту. До метро Салтівська - хвиилин 15 -20 пішки. Будинок дуже теплий, побудований в 90-х роках. Чистий, просторий підʼїзд, працює ліфт. Квартира на 6 поверсі, вікна виходять у тихий двір. Велика засклена лоджія 7 м2. Всі кімнати роздільні, санвузол роздільний, простора кухня. В квартирі свіжий сучасний ремонт, гарні сучасні меблі. На кухні вбудовані кухонні меблі, побутова кухонна техніка. Квартира з газом. Лічильники встановлені на газ та світло. Встановлена сигналізація. Телефонуйте! 7000 грн + ком.",50.03098,36.355452,2025-01-23 11:23:24,https://dom.ria.com/uk/realty-dolgosrochnaya-arenda-kvartira-harkov-saltovskiy-gvardeytsev-shironintsev-ulitsa-32680122.html
